<?xml version="1.0" encoding="UTF-8"?>
<?xml-stylesheet type="text/xsl" href="serie.xsl"?>
<collectionSeries xmlns:xsi="http://www.w3.org/2001/XMLSchema-instance" xmlns="http://allStreaming.altervista.org" xsi:schemaLocation="http://allStreaming.altervista.org serie.xsd">
	<serie>
		<title>The Mentalist</title>
		<photo>img/locandineSeries/the_mentalist.jpg</photo>
		<description>detective serie</description>
		<season>
			<numero>1</numero>
			<link>Nowvideo</link>
		</season>
		<season>
			<numero>2</numero>
			<link>Nowvideo</link>
		</season>
	</serie>
</collectionSeries>
